{
  "schema_version": "curriculum-full/v1",
  "subject": "en",
  "subject_name": "英语",
  "stage": "义务教育",
  "standard": {
    "name": "义务教育英语课程标准（2022年版）",
    "url": "https://www.moe.gov.cn/srcsite/A26/s8001/202204/t20220420_619921.html"
  },
  "note": "按主题语境、语言知识、语言技能、文化意识与学习策略组织；g1-g2 为启蒙扩展。",
  "coverage": {
    "grades": [
      "g1",
      "g2",
      "g3",
      "g4",
      "g5",
      "g6",
      "g7",
      "g8",
      "g9"
    ],
    "kp_count": 98,
    "domains": [
      "主题语境",
      "语言技能",
      "语言知识"
    ]
  },
  "grades": {
    "g1": {
      "summary": {
        "kp_count": 10,
        "domains": {
          "主题语境": 4,
          "语言技能": 3,
          "语言知识": 3
        }
      },
      "knowledge_points": [
        {
          "id": "kp-en-g1-theme-01-01",
          "subject": "en",
          "grade": "g1",
          "stage": "义务教育",
          "domain": "主题语境",
          "unit": "学校与自我",
          "title": "问候与告别",
          "description": "英语G1「学校与自我」中的核心知识点：问候与告别，用于支撑主题语境领域的学习、练习与诊断。",
          "objectives": [
            "能听懂或读懂问候与告别相关语言材料",
            "能在真实语境中使用问候与告别",
            "能完成相应的口头或书面表达任务"
          ],
          "key_exam_points": [
            "问候与告别",
            "词句理解",
            "情境交际",
            "阅读或写作迁移"
          ],
          "prerequisites": [],
          "difficulty_coordinate": {
            "grade": "g1",
            "bloom": "remember"
          },
          "source": {
            "type": "official_standard",
            "name": "义务教育英语课程标准（2022年版）",
            "url": "https://www.moe.gov.cn/srcsite/A26/s8001/202204/t20220420_619921.html",
            "note": "依据课程标准领域/学段要求整理，并结合常见教材单元顺序细化为内置知识点索引。"
          },
          "order": 1
        },
        {
          "id": "kp-en-g1-theme-01-02",
          "subject": "en",
          "grade": "g1",
          "stage": "义务教育",
          "domain": "主题语境",
          "unit": "学校与自我",
          "title": "姓名年龄表达",
          "description": "英语G1「学校与自我」中的核心知识点：姓名年龄表达，用于支撑主题语境领域的学习、练习与诊断。",
          "objectives": [
            "能听懂或读懂姓名年龄表达相关语言材料",
            "能在真实语境中使用姓名年龄表达",
            "能完成相应的口头或书面表达任务"
          ],
          "key_exam_points": [
            "姓名年龄表达",
            "词句理解",
            "情境交际",
            "阅读或写作迁移"
          ],
          "prerequisites": [
            "kp-en-g1-theme-01-01"
          ],
          "difficulty_coordinate": {
            "grade": "g1",
            "bloom": "remember"
          },
          "source": {
            "type": "official_standard",
            "name": "义务教育英语课程标准（2022年版）",
            "url": "https://www.moe.gov.cn/srcsite/A26/s8001/202204/t20220420_619921.html",
            "note": "依据课程标准领域/学段要求整理，并结合常见教材单元顺序细化为内置知识点索引。"
          },
          "order": 2
        },
        {
          "id": "kp-en-g1-theme-01-03",
          "subject": "en",
          "grade": "g1",
          "stage": "义务教育",
          "domain": "主题语境",
          "unit": "学校与自我",
          "title": "课堂指令",
          "description": "英语G1「学校与自我」中的核心知识点：课堂指令，用于支撑主题语境领域的学习、练习与诊断。",
          "objectives": [
            "能听懂或读懂课堂指令相关语言材料",
            "能在真实语境中使用课堂指令",
            "能完成相应的口头或书面表达任务"
          ],
          "key_exam_points": [
            "课堂指令",
            "词句理解",
            "情境交际",
            "阅读或写作迁移"
          ],
          "prerequisites": [
            "kp-en-g1-theme-01-02"
          ],
          "difficulty_coordinate": {
            "grade": "g1",
            "bloom": "remember"
          },
          "source": {
            "type": "official_standard",
            "name": "义务教育英语课程标准（2022年版）",
            "url": "https://www.moe.gov.cn/srcsite/A26/s8001/202204/t20220420_619921.html",
            "note": "依据课程标准领域/学段要求整理，并结合常见教材单元顺序细化为内置知识点索引。"
          },
          "order": 3
        },
        {
          "id": "kp-en-g1-theme-01-04",
          "subject": "en",
          "grade": "g1",
          "stage": "义务教育",
          "domain": "主题语境",
          "unit": "学校与自我",
          "title": "文具词汇",
          "description": "英语G1「学校与自我」中的核心知识点：文具词汇，用于支撑主题语境领域的学习、练习与诊断。",
          "objectives": [
            "能听懂或读懂文具词汇相关语言材料",
            "能在真实语境中使用文具词汇",
            "能完成相应的口头或书面表达任务"
          ],
          "key_exam_points": [
            "文具词汇",
            "词句理解",
            "情境交际",
            "阅读或写作迁移"
          ],
          "prerequisites": [
            "kp-en-g1-theme-01-03"
          ],
          "difficulty_coordinate": {
            "grade": "g1",
            "bloom": "remember"
          },
          "source": {
            "type": "official_standard",
            "name": "义务教育英语课程标准（2022年版）",
            "url": "https://www.moe.gov.cn/srcsite/A26/s8001/202204/t20220420_619921.html",
            "note": "依据课程标准领域/学段要求整理，并结合常见教材单元顺序细化为内置知识点索引。"
          },
          "order": 4
        },
        {
          "id": "kp-en-g1-know-02-01",
          "subject": "en",
          "grade": "g1",
          "stage": "义务教育",
          "domain": "语言知识",
          "unit": "语音启蒙",
          "title": "字母名称音",
          "description": "英语G1「语音启蒙」中的核心知识点：字母名称音，用于支撑语言知识领域的学习、练习与诊断。",
          "objectives": [
            "能听懂或读懂字母名称音相关语言材料",
            "能在真实语境中使用字母名称音",
            "能完成相应的口头或书面表达任务"
          ],
          "key_exam_points": [
            "字母名称音",
            "词句理解",
            "情境交际",
            "阅读或写作迁移"
          ],
          "prerequisites": [],
          "difficulty_coordinate": {
            "grade": "g1",
            "bloom": "remember"
          },
          "source": {
            "type": "official_standard",
            "name": "义务教育英语课程标准（2022年版）",
            "url": "https://www.moe.gov.cn/srcsite/A26/s8001/202204/t20220420_619921.html",
            "note": "依据课程标准领域/学段要求整理，并结合常见教材单元顺序细化为内置知识点索引。"
          },
          "order": 5
        },
        {
          "id": "kp-en-g1-know-02-02",
          "subject": "en",
          "grade": "g1",
          "stage": "义务教育",
          "domain": "语言知识",
          "unit": "语音启蒙",
          "title": "大小写字母",
          "description": "英语G1「语音启蒙」中的核心知识点：大小写字母，用于支撑语言知识领域的学习、练习与诊断。",
          "objectives": [
            "能听懂或读懂大小写字母相关语言材料",
            "能在真实语境中使用大小写字母",
            "能完成相应的口头或书面表达任务"
          ],
          "key_exam_points": [
            "大小写字母",
            "词句理解",
            "情境交际",
            "阅读或写作迁移"
          ],
          "prerequisites": [
            "kp-en-g1-know-02-01"
          ],
          "difficulty_coordinate": {
            "grade": "g1",
            "bloom": "remember"
          },
          "source": {
            "type": "official_standard",
            "name": "义务教育英语课程标准（2022年版）",
            "url": "https://www.moe.gov.cn/srcsite/A26/s8001/202204/t20220420_619921.html",
            "note": "依据课程标准领域/学段要求整理，并结合常见教材单元顺序细化为内置知识点索引。"
          },
          "order": 6
        },
        {
          "id": "kp-en-g1-know-02-03",
          "subject": "en",
          "grade": "g1",
          "stage": "义务教育",
          "domain": "语言知识",
          "unit": "语音启蒙",
          "title": "基础自然拼读音素",
          "description": "英语G1「语音启蒙」中的核心知识点：基础自然拼读音素，用于支撑语言知识领域的学习、练习与诊断。",
          "objectives": [
            "能听懂或读懂基础自然拼读音素相关语言材料",
            "能在真实语境中使用基础自然拼读音素",
            "能完成相应的口头或书面表达任务"
          ],
          "key_exam_points": [
            "基础自然拼读音素",
            "词句理解",
            "情境交际",
            "阅读或写作迁移"
          ],
          "prerequisites": [
            "kp-en-g1-know-02-02"
          ],
          "difficulty_coordinate": {
            "grade": "g1",
            "bloom": "remember"
          },
          "source": {
            "type": "official_standard",
            "name": "义务教育英语课程标准（2022年版）",
            "url": "https://www.moe.gov.cn/srcsite/A26/s8001/202204/t20220420_619921.html",
            "note": "依据课程标准领域/学段要求整理，并结合常见教材单元顺序细化为内置知识点索引。"
          },
          "order": 7
        },
        {
          "id": "kp-en-g1-skill-03-01",
          "subject": "en",
          "grade": "g1",
          "stage": "义务教育",
          "domain": "语言技能",
          "unit": "听说启蒙",
          "title": "听懂简单指令",
          "description": "英语G1「听说启蒙」中的核心知识点：听懂简单指令，用于支撑语言技能领域的学习、练习与诊断。",
          "objectives": [
            "能听懂或读懂听懂简单指令相关语言材料",
            "能在真实语境中使用听懂简单指令",
            "能完成相应的口头或书面表达任务"
          ],
          "key_exam_points": [
            "听懂简单指令",
            "词句理解",
            "情境交际",
            "阅读或写作迁移"
          ],
          "prerequisites": [],
          "difficulty_coordinate": {
            "grade": "g1",
            "bloom": "remember"
          },
          "source": {
            "type": "official_standard",
            "name": "义务教育英语课程标准（2022年版）",
            "url": "https://www.moe.gov.cn/srcsite/A26/s8001/202204/t20220420_619921.html",
            "note": "依据课程标准领域/学段要求整理，并结合常见教材单元顺序细化为内置知识点索引。"
          },
          "order": 8
        },
        {
          "id": "kp-en-g1-skill-03-02",
          "subject": "en",
          "grade": "g1",
          "stage": "义务教育",
          "domain": "语言技能",
          "unit": "听说启蒙",
          "title": "模仿跟读",
          "description": "英语G1「听说启蒙」中的核心知识点：模仿跟读，用于支撑语言技能领域的学习、练习与诊断。",
          "objectives": [
            "能听懂或读懂模仿跟读相关语言材料",
            "能在真实语境中使用模仿跟读",
            "能完成相应的口头或书面表达任务"
          ],
          "key_exam_points": [
            "模仿跟读",
            "词句理解",
            "情境交际",
            "阅读或写作迁移"
          ],
          "prerequisites": [
            "kp-en-g1-skill-03-01"
          ],
          "difficulty_coordinate": {
            "grade": "g1",
            "bloom": "remember"
          },
          "source": {
            "type": "official_standard",
            "name": "义务教育英语课程标准（2022年版）",
            "url": "https://www.moe.gov.cn/srcsite/A26/s8001/202204/t20220420_619921.html",
            "note": "依据课程标准领域/学段要求整理，并结合常见教材单元顺序细化为内置知识点索引。"
          },
          "order": 9
        },
        {
          "id": "kp-en-g1-skill-03-03",
          "subject": "en",
          "grade": "g1",